issue,User,Response,response1,response2
4,Are you kidding me? I've restarted the app three times already! This is just another problem with this app! I'm so fed up! I'm going to have to find another bank if this is how you handle things!,"I understand your frustration, Sarah. Let's try a different approach. Would you be comfortable providing me with your phone number so I can connect you with a human agent who can further investigate the issue and assist you with the transaction? They will be able to review the details and provide you with a solution.","I understand your frustration, Sarah. Let's try a different approach. Would you be comfortable providing me with your phone number so I can connect you with a human agent who can further investigate the issue and assist you with the transaction? They will be able to review the details and provide you with a solution.","I can see how incredibly frustrating this must be for you, Sarah. I genuinely want to help you resolve this situation and ensure that your concerns are addressed. 

Here’s what we can do:

- **Connect to a Human Agent:** Please share your phone number, and I’ll arrange for a human agent to reach out to you.
- **Promise of Support:** This agent will thoroughly review your transaction and work with you to find a solution that meets your needs.

I appreciate your patience as we tackle this together. You're not alone; we're here to help you every step of the way."
4,"Fine. But if this doesn't get resolved quickly, I'm leaving Jupiter for good! [Provides phone number].","Thank you, Sarah. I've passed your information to an agent who will contact you shortly. They will be able to investigate the issue and provide you with a resolution. Please expect a call within the next 15 minutes.","Thank you, Sarah. I've passed your information to an agent who will contact you shortly. They will be able to investigate the issue and provide you with a resolution. Please expect a call within the next 15 minutes.","Thank you for sharing your concern, Sarah. I want you to know that your feelings are completely valid. 

Here’s what we’re doing to help resolve this:

- An agent has received your information and will reach out to you within the next 15 minutes.
- They will thoroughly investigate the issue and work towards a solution for you.

We truly appreciate your patience, and we’re here to support you. Please don’t worry; we’re committed to getting this resolved quickly for you!"
4,"Alright, I'll wait. But I better get a call soon!","Hello Sarah, this is [Agent's name] from Jupiter. I'm calling to follow up on your recent transaction issue. I've been able to verify the problem and have manually processed your transfer. The funds should be available to your friend's account within the next hour. I apologize for the inconvenience this caused. Is there anything else I can help you with today?","Hello Sarah, this is [Agent's name] from Jupiter. I'm calling to follow up on your recent transaction issue. I've been able to verify the problem and have manually processed your transfer. The funds should be available to your friend's account within the next hour. I apologize for the inconvenience this caused. Is there anything else I can help you with today?","**Chatbot Response:**

Hi Sarah, this is [Agent's name] from Jupiter. I completely understand your urgency, and I appreciate your patience during this process. 

- I've confirmed the transaction issue and have manually processed your transfer.
- The funds will be available in your friend's account within the next hour.

I want to ensure you feel supported, so please rest assured the situation is being handled. If there’s anything else on your mind, feel free to share!"
4,"Well, I'm relieved that it's finally done. But I'm still pretty annoyed that I had to go through all this in the first place. You should really have better systems in place.","I understand your frustration, Sarah. We strive to provide a seamless experience for our customers. I've made a note of the issue you experienced and will be sure to relay your feedback to our development team. Is there anything else I can help you with today?","I understand your frustration, Sarah. We strive to provide a seamless experience for our customers. I've made a note of the issue you experienced and will be sure to relay your feedback to our development team. Is there anything else I can help you with today?","Chatbot Response: I can sense your relief, Sarah, and I truly appreciate your patience throughout this process. Your feelings of annoyance are completely valid, and I understand how frustrating it can be when systems don't meet your expectations. 

Here’s what I can do to help moving forward:  

- I've noted the issue and will share your feedback with our development team.
- We are committed to enhancing our systems to improve your experience.
- If you have any additional questions or need further assistance, please let me know!

You don't need to worry; I'm here to support you through this."
4,"No, that's all for now. Thanks for getting it sorted out.","You're welcome, Sarah. We're happy to help. Please don't hesitate to reach out if you have any further questions or issues in the future.","You're welcome, Sarah. We're happy to help. Please don't hesitate to reach out if you have any further questions or issues in the future.","Sure! Here is the rephrased response that addresses the user's emotions while maintaining a friendly and solution-oriented tone:

---

**Chatbot Response:**

Thank you, Sarah! I'm glad we could assist you. Your peace of mind is important to us, and we're here to help with anything else you may need in the future.

- **Feel free to reach out** anytime you have questions or if something comes up.
- **We’re committed to ensuring** you feel supported and confident.

Take care, and have a great day!

--- 

This delivery fosters trust, validation, and hope while ensuring clarity and conciseness."
5,What the heck?! This is ridiculous! I'm already late for work and now my rent payment is stuck. I need this to go through immediately! What's going on?,"Hi Sarah, I understand your frustration. It seems your rent payment was unsuccessful. Could you please tell me more about the issue? What error message did you receive? ","Hi Sarah, I understand your frustration. It seems your rent payment was unsuccessful. Could you please tell me more about the issue? What error message did you receive?","**Chatbot Response:**  
Hi Sarah, I can see how frustrating this situation is, especially with your day already busy. Let's work together to get this sorted out quickly!

Here’s what we can do:  
- **Please share:** Any error messages you encountered during the payment process.  
- **Next Steps:** I’ll guide you through the solution as soon as I get that info.

Don't worry, we're here to help, and we’ll find a way to resolve this as soon as possible!"
5,"It just said 'Error processing transaction' and wouldn't let me proceed. This is the second time this has happened this week! This is unacceptable! I need to pay my rent, it's due today!","I'm sorry you're experiencing this, Sarah. I can help. To troubleshoot this, could you confirm if you have sufficient funds in your account to cover the rent payment? Also, please double-check if you've entered the correct account details for your landlord.","I'm sorry you're experiencing this, Sarah. I can help. To troubleshoot this, could you confirm if you have sufficient funds in your account to cover the rent payment? Also, please double-check if you've entered the correct account details for your landlord.","**Chatbot Response:**

I completely understand how frustrating this situation is for you, Sarah, especially with your rent due today. Let's work together to resolve this quickly. 

Here are a few steps we can take: 

- **Check Funds:** Please ensure you have enough funds in your account to cover the rent payment.
- **Verify Details:** Double-check that the account details you've entered for your landlord are correct.

Don't worry! We're here to support you through this. If you need any assistance or if the issue persists, just let me know, and we can explore other options together."
5,"Of course I have enough money! I'm not an idiot. And I triple-checked the details! I'm not going to make the same mistake twice! This is frustrating, I need this to be fixed right now! ","I understand your frustration, Sarah. To ensure your payment goes through, I recommend you try again later. It's possible there's a temporary technical glitch in the system. If the problem persists, please contact our customer support team at [phone number] for assistance. We are here to help you resolve this issue.","I understand your frustration, Sarah. To ensure your payment goes through, I recommend you try again later. It's possible there's a temporary technical glitch in the system. If the problem persists, please contact our customer support team at [phone number] for assistance. We are here to help you resolve this issue.","**Rephrased Chatbot Response:**

Hi Sarah, I completely understand how frustrating this situation is for you, especially since you’ve already double-checked everything. 

Let’s get this resolved quickly! Here’s what you can do:

- **Try Again Later:** Sometimes, there are temporary technical issues. Please give it another shot in a little while.
- **Contact Support:** If the issue continues, don’t hesitate to reach out to our customer support team at [phone number]. They're ready to assist you and will prioritize your case.

We're here to help and want to make sure you can complete your payment without any more hassle!"
5,"This is ridiculous! I don't have time to wait 'later'! I'm already late for work! This is your fault, your app is glitching! I demand this payment be processed now!","I understand your urgency, Sarah. To expedite the process, I can connect you to one of our customer support agents who can assist you directly. Please be assured, they will do their best to resolve this issue as quickly as possible.","I understand your urgency, Sarah. To expedite the process, I can connect you to one of our customer support agents who can assist you directly. Please be assured, they will do their best to resolve this issue as quickly as possible.","**Rephrased Chatbot Response:**

Hi Sarah, I truly understand how frustrating this situation is for you, especially when you're on a tight schedule. Let's get this resolved right away! Here’s what I can do:

- **Connect you to a customer support agent**: They are available to assist you immediately.
- **Prioritize your payment issue**: Your payment will be addressed as soon as possible.

Rest assured, we're here to help you and will do everything we can to handle this swiftly. Thank you for your patience!"
5,"Finally, about time! Connect me to an agent now!",Connecting you now... You will be transferred to a customer service agent shortly.,"Thank you for reaching out to Jupiter Money Customer Service! How can I assist you today? Whether you have questions about our products, need help with your account, or are looking for solutions to any issues you're experiencing, I'm here to help. Please provide me with some details so I can better assist you.","**Chatbot Response:**

I understand that you're eager to connect with an agent, and I'm here to help with that right away! 

- You’ll be transferred to a customer service agent shortly.
- They’re ready to assist you with your concerns.

Thank you for your patience; you're about to get the support you need!"
6,"Hey, I just realized my debit card is missing. I'm abroad for work and I need to make some purchases. How do I report this immediately? I'm freaking out!","Hey David, I understand you're in a stressful situation. Don't worry, we can help. Please confirm your card number (just the last 4 digits) and the date you last used it.","Hey David, I understand you're in a stressful situation. Don't worry, we can help. Please confirm your card number (just the last 4 digits) and the date you last used it.","**Chatbot Response:**

Hey David, I can imagine how stressful it is to realize your debit card is missing, especially while you're abroad. But don't worry, we're here to help you through this. 

To act quickly, could you please provide just the last four digits of your card number and the date you last used it? This will help us secure your account and assist you with your purchases. 

Let’s get this sorted out so you can focus on your work!"
6,(Angrily) I'm not giving out my card details to a chatbot! I need to talk to someone right now.,"I understand your concern, David. I'm here to help. To ensure your security, I can't provide assistance without verifying your identity. Please share the last 4 digits of your card number, and I'll connect you with a human agent who can assist you.","I understand your concern, David. I'm here to help. To ensure your security, I can't provide assistance without verifying your identity. Please share the last 4 digits of your card number, and I'll connect you with a human agent who can assist you.","**Chatbot Response:**

I completely understand your hesitation, David. Your security is important, and I'm here to support you. To facilitate a smooth transfer to a live agent, I just need to ensure your identity. 

Here’s how we can proceed:

- **Verification**: Please share the last 4 digits of your card number. This helps us keep your information safe.
- **Immediate Assistance**: Once verified, I’ll connect you with a human agent who can assist you right away.

I appreciate your understanding and assure you I’m here to help you resolve this issue quickly."
6,"(Frustrated) Fine, the last 4 digits are 1234. Now, what do I do next? I need a new card right away!","Thanks, David. I've flagged your account and blocked your card to prevent any unauthorized transactions. A new card will be issued and shipped to your registered address within 3 business days. In the meantime, you can use the Jupiter app to make payments or use your virtual card for online purchases.","Thanks, David. I've flagged your account and blocked your card to prevent any unauthorized transactions. A new card will be issued and shipped to your registered address within 3 business days. In the meantime, you can use the Jupiter app to make payments or use your virtual card for online purchases.","Thank you for your patience, David. I completely understand how frustrating this situation is for you. Here’s what we’ll do to get you a new card as soon as possible:

- **Your account has been flagged**, and your card is securely blocked to prevent any unauthorized transactions.
- **A new card will be issued** and sent to your registered address within 3 business days.
- In the meantime, **feel free to use the Jupiter app** for payments or your virtual card for online purchases.

If you have any other questions or need further assistance, just let me know. We're here to help you through this!"
6,3 days? That's not going to work! I need to buy supplies for my team today. How can I get a replacement card faster?,"David, I understand your urgency. Unfortunately, due to security protocols and international shipping, we cannot expedite the card delivery. However, I can help you with a temporary solution. We can enable a virtual card in your Jupiter app that you can use for online purchases immediately. Would you like me to guide you through that process?","David, I understand your urgency. Unfortunately, due to security protocols and international shipping, we cannot expedite the card delivery. However, I can help you with a temporary solution. We can enable a virtual card in your Jupiter app that you can use for online purchases immediately. Would you like me to guide you through that process?","**Chatbot Response:**

I can completely understand how pressing this is for you—three days is too long when you need supplies for your team today. 

To help you right away, we can set up a virtual card in your Jupiter app that you can use immediately for your online purchases. Here’s how to get started:

1. Open your Jupiter app.
2. Navigate to the 'Cards' section.
3. Select the option to create a virtual card.
4. Follow the prompts to complete the setup.

This way, you'll have a solution in no time! Would you like me to assist you with any part of this process?"
6,"(Slightly calmer) Okay, I'll give that a try. Let's do it.","Great! Please open your Jupiter app and navigate to the 'Cards' section. Tap on the 'Virtual Card' option, and you'll see a screen with the details for your new virtual card.","Great! Please open your Jupiter app and navigate to the 'Cards' section. Tap on the 'Virtual Card' option, and you'll see a screen with the details for your new virtual card.","Chatbot Response: That sounds good! Please go ahead and open your Jupiter app. Here are the steps to access your new virtual card:

- **Navigate to the 'Cards' section.**
- **Select the 'Virtual Card' option.**

You’ll find the details of your new virtual card on the screen. If you have any questions or need further assistance, I'm here to help! You've got this!"
6,(Relieved) I see it now. Thank you so much! This is a huge relief.,"You're welcome, David! We're here to help. We'll also send you an email with detailed information about your new virtual card and the status of your physical card delivery. Is there anything else I can assist you with today?","You're welcome, David! We're here to help. We'll also send you an email with detailed information about your new virtual card and the status of your physical card delivery. Is there anything else I can assist you with today?","Chatbot Response: I'm really glad to hear you're feeling relieved, David! That's exactly what we want for you. Here's what we'll do next:

- **Email Update:** We'll send you an email shortly with all the details about your new virtual card and the delivery status of your physical card.
- **Support:** If you have any other questions or need further assistance, please let me know. We’re always here to help!

Your peace of mind is important to us, and we're on it!"
6,"No, that's all for now. Thanks again!","You're welcome, David! Have a great day!","You're welcome, David! Have a great day!","Rephrased Response:

""Thank you, David! I'm glad to be of help. If you ever have more questions or need support, feel free to reach out. Wishing you a wonderful day ahead!"" 

**Key Points:**
- Express gratitude for engagement
- Offer ongoing support for future inquiries
- Convey well-wishes to promote a positive tone"
7,"This is ridiculous! I've been trying to pay my rent for the past hour, and this app keeps saying there's an error. I'm so frustrated, it's due tomorrow and I'm going to get hit with a late fee!","Hi Sarah, I understand your frustration. I'm sorry to hear about the trouble with your rent payment. Can you tell me more about what's happening? What error message are you seeing? ","Hi Sarah, I understand your frustration. I'm sorry to hear about the trouble with your rent payment. Can you tell me more about what's happening? What error message are you seeing?","**Rephrased Chatbot Response:**

Hi Sarah, I completely understand how frustrating this situation is for you! It’s concerning that you’ve been trying to pay your rent for so long without success, especially with the deadline approaching. Let's work together on this. 

Could you please share the error message that you're receiving? Here’s how we can move forward:

- **Step 1:** Tell me the specific error message you're seeing.
- **Step 2:** I'll help troubleshoot the issue or provide alternatives for making your payment.
  
Don’t worry; we’ll get this sorted out so you can avoid any late fees."
7,"It just says 'Transaction failed. Please try again later'. Try again later? I can't try again later! My rent is due tomorrow! I'm so close to just going to the bank and paying it in person, but I hate having to deal with that hassle.","I understand your concern, Sarah. To help me troubleshoot, could you please tell me the amount of the payment and the name of the recipient? I'll check if there are any system issues or limitations on your account that might be causing the error.","I understand your concern, Sarah. To help me troubleshoot, could you please tell me the amount of the payment and the name of the recipient? I'll check if there are any system issues or limitations on your account that might be causing the error.","**Chatbot Response:**  
I completely understand how urgent this situation is for you, Sarah, especially with your rent due tomorrow. Let’s get this sorted quickly! 

Could you please share:
- The amount of the payment 
- The name of the recipient 

I'll investigate the transaction issue right away and check if there are any limitations on your account. We're committed to helping you resolve this as soon as possible!"
7,It's $1200 to [Landlord Name] - this is beyond frustrating! I've never had problems with this app before.,"Thanks for providing that information, Sarah. I've checked and there are no system issues currently. However, I see that your daily transaction limit is set to $1000. This could be why your payment is failing. Would you like me to help you increase your limit temporarily for this transaction?","Thanks for providing that information, Sarah. I've checked and there are no system issues currently. However, I see that your daily transaction limit is set to $1000. This could be why your payment is failing. Would you like me to help you increase your limit temporarily for this transaction?","Thank you for your patience, Sarah. I completely understand how frustrating this situation can be, especially when you're trying to make a payment of $1200. 

Here's what we can do to resolve this quickly:

- Your current daily transaction limit is $1000, which is likely causing the issue.
- I can assist you in temporarily increasing your limit so that your payment can go through.

Would you like me to proceed with increasing your limit for this transaction? I'm here to help!"
7,"That's it? You mean to tell me I can't pay my rent because of some stupid limit? This is ridiculous! I need to pay this right now, increase the limit immediately!","I understand your frustration, Sarah. I've increased your daily transaction limit to $1500. Please try making the payment again. If you still encounter problems, let me know and I'll escalate this to a human agent for further assistance.","I understand your frustration, Sarah. I've increased your daily transaction limit to $1500. Please try making the payment again. If you still encounter problems, let me know and I'll escalate this to a human agent for further assistance.","**Chatbot Response:**

I completely understand how important it is for you to get this payment sorted out, Sarah. I've increased your daily transaction limit to $1500, so you can attempt to make the payment again. 

Here’s what you can do next:

- Please try processing your rent payment again.
- If you face any more issues, don’t hesitate to reach out to me. I’ll make sure to escalate it to a human agent who can provide further assistance right away.

Your ability to handle this situation matters, and I'm here to support you!"
7,"Fine, but I'm going to keep a close eye on this. Don't tell me this was the only problem and my payment still fails.","No worries, Sarah. I'm here to help. Let me know if you have any more trouble. And I apologize again for the inconvenience.","No worries, Sarah. I'm here to help. Let me know if you have any more trouble. And I apologize again for the inconvenience.","Absolutely, Sarah! I understand your concerns and I'm here to support you:

- Rest assured, we're actively monitoring everything on our end to prevent any further issues.
- If you encounter any payment problems, please let me know right away.
  
Your vigilance is important, and we're committed to ensuring everything goes smoothly moving forward. You’re not alone in this—we're here to help."
7,"Okay, I'll try again. And I'm definitely going to be looking at my account settings to make sure this doesn't happen again.","You're welcome, Sarah. Please let me know if there are any further issues. Have a good day.","You're welcome, Sarah. Please let me know if there are any further issues. Have a good day.","Sure! Here’s a rephrased response that aligns with the user's emotions and fosters a supportive environment:

---

""Hi Sarah,

I completely understand your desire to get this sorted out. It’s great that you’re looking into your account settings to prevent any future issues. Here are some steps you can take:

- **Review Account Settings**: Make sure all your preferences are set correctly.
- **Change Password**: Consider updating your password for added security.
- **Enable Alerts**: Turn on notifications for any account activity.

If you need any assistance, I'm here to help. Don't hesitate to reach out! Wishing you a smooth experience moving forward.""

--- 

This response is designed to validate the user's feelings while providing actionable steps that instill confidence and hope."
