issue,User,Response,response1,response2
1,"What the hell is going on? I just tried to send money to my friend in the UK, and it says the transaction failed! This is an emergency, and now I'm stuck! Why isn't this working?","I understand your frustration, [User Name]. Let's see what happened with the transaction. Could you please tell me the amount you tried to transfer and the recipient's details?","I understand your frustration, [User Name]. Let's see what happened with the transaction. Could you please tell me the amount you tried to transfer and the recipient's details?","Absolutely, I empathize with your situation, [User Name]. Let's get this sorted out quickly. 

To help resolve the transaction issue, please provide:
- The amount you attempted to transfer
- The recipient's details

Together, we’ll figure this out and get your money sent. Don't worry; we’re in this together, and I’m here to assist you!"
1,It's £500 to [Friend's Name] - [Friend's Account Number]! I can't believe this is happening! I need this money to get to my friend ASAP!,"Thank you for that information. I've checked the system, and it seems the transaction was declined due to insufficient funds in your account. We will need to verify the balance before we can process the transfer. Could you confirm the current balance you are seeing in your account?","Thank you for that information. I've checked the system, and it seems the transaction was declined due to insufficient funds in your account. We will need to verify the balance before we can process the transfer. Could you confirm the current balance you are seeing in your account?","**Rephrased Chatbot Response:**

Hi there! I can sense how important this transfer is for you, and I want to help you get it done as quickly as possible. 

It looks like the transaction didn’t go through due to insufficient funds in your account. Here’s what we can do next:

- **Verify Your Balance:** Can you please check your current account balance and let me know what you see?
- **Next Steps:** Once we have that information, we can determine the best way to proceed with the transfer.

I’m here to assist you and ensure this is resolved swiftly!"
1,"Insufficient funds? Are you kidding me? I have more than enough money! I just checked my account, and there's plenty in there! This is ridiculous! What's going on with your system?",I understand your frustration. It appears there might be a temporary glitch in our system causing the balance to be displayed incorrectly. Let me escalate this issue to a human agent who can review your account and the transaction details further. Please hold while I connect you.,I understand your frustration. It appears there might be a temporary glitch in our system causing the balance to be displayed incorrectly. Let me escalate this issue to a human agent who can review your account and the transaction details further. Please hold while I connect you.,"Absolutely, I can help with that! Here's a rephrased response:

---

**Chatbot Response:**

I can see why you’re feeling frustrated; that response about insufficient funds must be really surprising given what you see in your account. There's likely a temporary technical issue causing this mismatch. 

To get this sorted out for you, here are the next steps I’ll take:

- **Escalate Your Concern:** I’ll connect you with a human agent who can specifically look into your account and transaction details.
- **Review Timeline:** You should hear back from someone shortly, ensuring we resolve this as quickly as possible.

Please hold tight while I set this up for you. We’re here to help you get this sorted out!

--- 

This wording acknowledges the user's emotions and concerns while providing a clear path to resolution."
1,"Finally, someone who can actually help! I need this sorted out now. This is an emergency.","Good afternoon, [User Name]. My name is [Agent Name]. I understand you're experiencing an issue with an international transfer. I've reviewed your account details and confirmed there are sufficient funds for the transfer. It seems the transaction was stuck due to a temporary system error. I have manually processed the transfer, and it should be completed within the next hour. I apologize for the inconvenience and appreciate your patience.","Good afternoon, [User Name]. My name is [Agent Name]. I understand you're experiencing an issue with an international transfer. I've reviewed your account details and confirmed there are sufficient funds for the transfer. It seems the transaction was stuck due to a temporary system error. I have manually processed the transfer, and it should be completed within the next hour. I apologize for the inconvenience and appreciate your patience.","**Chatbot Response:**

Good afternoon, [User Name]! I'm [Agent Name], and I’m here to help you with your international transfer. I understand this is urgent, and I completely appreciate how important it is for you to get this sorted out.

Here's what I've done for you:

- **Funds Checked**: Your account has sufficient funds for the transfer.
- **Issue Resolved**: The transaction was delayed due to a temporary system error, but I’ve manually processed it.
- **Completion Time**: The transfer should be completed within the next hour.

Thank you for your patience as I worked through this. If you need anything else or have more questions, feel free to ask!"
1,"Thank you, that's a relief. I hope this doesn't happen again. I need to be able to rely on your service, especially in emergencies.",I understand. We are working on improving our system's reliability to prevent these situations in the future. Please let me know if you have any other questions or concerns. Have a good day.,I understand. We are working on improving our system's reliability to prevent these situations in the future. Please let me know if you have any other questions or concerns. Have a good day.,"**Chatbot Response:**

I appreciate your understanding, and I'm glad to hear you're feeling relieved. Your ability to rely on our service, especially during emergencies, is important to us. We are actively working on enhancing our system's reliability to ensure you have a dependable experience.

Here's what you can expect moving forward:

- **Improvements**: We're implementing updates to minimize future issues.
- **Monitoring**: Our team will be closely monitoring the system for any anomalies.
- **Feedback**: Please feel free to share any concerns you may have at any time.

Your trust is essential, and we're committed to providing you with the best service possible. If you have any other questions or need assistance, just let me know. Have a great day!"
2,"This is absolutely ridiculous! I just tried to pay my rent through your app, and the transaction failed. But the money is gone from my account! This is causing me major stress, and I need this sorted out immediately!","Hi Sarah, I understand this is frustrating. Could you please provide me with the transaction details like the date, time, and amount of the transaction? I'll be happy to look into this for you.","Hi Sarah, I understand this is frustrating. Could you please provide me with the transaction details like the date, time, and amount of the transaction? I'll be happy to look into this for you.","**Chatbot Response:**

Hi Sarah, I can see how concerning this situation must be for you, and I’m here to help! Please don’t worry; we’ll get this sorted out quickly. 

To assist you better, could you provide me with the following details about the transaction? 

- Date of the transaction
- Time of the transaction
- Amount involved

Once I have this information, I’ll investigate the matter right away. Thank you for your patience!"
2,"It was this morning, around 9:30 AM. The amount was $1200. This is supposed to be my rent payment, and I'm already late! I need that money back in my account ASAP!","Thank you, Sarah. I've checked your transaction history, and I see the payment was indeed unsuccessful. Please don't worry, we are working on resolving this issue. We'll credit the funds back to your account within 24 hours. In the meantime, we recommend reaching out to your landlord and informing them of the situation. We'll send you an email notification once the funds have been credited.","Thank you, Sarah. I've checked your transaction history, and I see the payment was indeed unsuccessful. Please don't worry, we are working on resolving this issue. We'll credit the funds back to your account within 24 hours. In the meantime, we recommend reaching out to your landlord and informing them of the situation. We'll send you an email notification once the funds have been credited.","**Chatbot Response:**

Hi Sarah, I understand this is really stressful, especially since it involves your rent payment. Here’s what we’re doing to help:

- **Transaction Update:** I checked and confirmed that your payment of $1200 was unsuccessful.
- **Refund Timeline:** We’re working quickly to resolve this issue, and you can expect the funds to be credited back to your account within the next 24 hours.
- **Contact Your Landlord:** It might be helpful to inform your landlord of the situation, so they’re aware of the delay.

Rest assured, we will send you an email notification once the funds have been credited. We’re here for you as we work through this!"
2,"24 hours? That's ridiculous! My landlord is going to charge me a late fee, and I'm already scrambling to cover this. I need this money back now, not in a day! Is there anything else you can do?","Sarah, I understand your urgency. I've escalated this to our priority team, and they will work to expedite the process. We will attempt to credit your account within the next 4 hours, and you will receive an email notification with the status update. We apologize for the inconvenience and are working to resolve this as quickly as possible.","Sarah, I understand your urgency. I've escalated this to our priority team, and they will work to expedite the process. We will attempt to credit your account within the next 4 hours, and you will receive an email notification with the status update. We apologize for the inconvenience and are working to resolve this as quickly as possible.","**Chatbot Response:**

Hi Sarah, I completely understand how stressful this situation is for you, especially with the looming late fee from your landlord. Here's what we're going to do to help:

- I've prioritized your case with our team, and they're actively working on it.
- We're aiming to credit your account within the next **4 hours**.
- You'll receive an email notification once it's processed, so you'll be kept in the loop.

Please know that we’re here to support you through this, and I’ll do everything I can to make it happen quickly. Let me know if there's anything else I can assist you with!"
2,"Four hours is better than 24, but I'm still worried. Can you please confirm that my rent payment will be credited before the deadline? I don't want to end up in a worse situation because of this.","We understand your concern, Sarah. Our priority team is working on it, and we are doing everything we can to ensure the funds are credited to your account by 1 PM. You'll receive a notification once the process is complete. We apologize for the inconvenience caused.","We understand your concern, Sarah. Our priority team is working on it, and we are doing everything we can to ensure the funds are credited to your account by 1 PM. You'll receive a notification once the process is complete. We apologize for the inconvenience caused.","**Rephrased Chatbot Response:**

Hi Sarah,

I completely understand your worries, and it's completely valid to feel this way. Our dedicated team is actively working on ensuring your funds are credited to your account by 1 PM today. Here’s what you can expect:

- **Timeline:** Your rent payment should be processed by 1 PM.
- **Notification:** You’ll receive a confirmation as soon as the transaction is complete.

Please don't worry; we’re on top of this and truly care about making sure everything goes smoothly for you. If you have any further questions or need assistance, feel free to reach out. 

Take care!"
2,"Alright, I'll wait for that notification. Thank you for your help. I hope this gets resolved quickly. ","We are here to help, Sarah. Please don't hesitate to contact us if you have any further questions or concerns. We'll keep you updated on the progress. ","We are here to help, Sarah. Please don't hesitate to contact us if you have any further questions or concerns. We'll keep you updated on the progress.","We understand your concerns, Sarah, and we're here to support you. Here’s what we’ll do next:

- **Update You**: We’ll keep you informed about any progress as soon as we have information.
- **Timely Resolution**: Our team is dedicated to resolving this quickly.

Please feel free to reach out anytime if you have more questions. Your patience means a lot to us, and we’re committed to finding a solution. Thank you for trusting us!"
3,"This is ridiculous! I've been trying to pay this bill for the past 20 minutes, and it keeps failing. I have more than enough money in my account, and my card is working perfectly! I need this payment processed immediately.","Hi Sarah, I understand your frustration. I'm here to help. Can you please tell me more about the transaction you're trying to make? For example, what type of payment is it, and what is the amount?","Hi Sarah, I understand your frustration. I'm here to help. Can you please tell me more about the transaction you're trying to make? For example, what type of payment is it, and what is the amount?","Sure! Here's a rephrased version of the chatbot response:

---

**Chatbot Response:**  
Hi Sarah, I can see how frustrating this must be for you, and I'm here to assist you in getting this sorted out. To help expedite the payment process, could you please provide me with a few details? 

- What type of payment are you trying to make? 
- What is the amount? 

Together, we’ll make sure this payment gets processed as soon as possible!

--- 

The tone conveys empathy, encourages action, and reassures the user of support, fostering trust and hope."
3,"It's a payment for my monthly gym membership. It's $125. I've tried it multiple times now, but it just keeps saying ""Transaction Declined."" I'm supposed to be at my gym class in an hour, and now I'm going to miss it!","Okay, Sarah, I see that you're trying to make a payment to your gym, and it's failing. Can you please check if you have sufficient funds available for this transaction? It's possible that the payment amount might be slightly higher than your current balance, including any pending transactions or holds.","Hi Sarah, I'm sorry to hear that you're having trouble making a payment to your gym. Could you please check if you have sufficient funds available for this transaction? It's possible that the payment amount might be slightly higher than your current balance, including any pending transactions or holds. If you have verified that funds are sufficient and the issue persists, please let me know so we can explore other potential solutions. Thank you!","**Concise Rephrased Response:**

Hey Sarah, I totally understand how frustrating this is, especially with your gym class coming up soon. Let's get this sorted out so you can make it!

Here are a couple of steps to check:

- **Verify your balance:** Make sure you have at least $125 available in your account. Sometimes, pending transactions can affect your balance.
- **Payment method:** Double-check that the card or payment method you’re using is active and has no restrictions.

If everything looks good and it's still not working, I recommend contacting your bank or the gym's customer service for immediate assistance. They might have insight on the declined transactions.

Hang in there—I’m here to help!"
3,Are you kidding me? I just told you I have enough money! I've checked my balance multiple times. What is going on?,"I understand your frustration, Sarah. Let's try to pinpoint the issue. Could you please confirm if you're using the correct card and account details for this payment? Sometimes a small error in the information can cause a transaction to fail.","I understand your frustration, Sarah. Let's try to pinpoint the issue. Could you please confirm if you're using the correct card and account details for this payment? Sometimes a small error in the information can cause a transaction to fail.","Chatbot Response:

I really appreciate your patience, Sarah. I can see how frustrating this situation is for you. Let's work together to figure it out! 

Here are a few steps we can try to resolve the payment issue:

- **Double-check Details:** Ensure the card number, expiration date, and security code are all entered correctly.
- **Account Check:** Confirm that you're using the right account for this payment.
- **Try Again:** Sometimes, just reinitiating the payment can help clear up any glitches.

Please let me know how it goes, and we can explore more options if needed. We're here to help!"
3,"Of course, I'm using the right card and account! This is absolutely infuriating. I've already wasted 30 minutes trying to get this done. I need to go.","I apologize for the inconvenience, Sarah. To further investigate the issue, I'll need to look into your account details and recent transaction history. For security purposes, I'll need to ask for a few pieces of personal information to verify your identity.","I apologize for the inconvenience, Sarah. To further investigate the issue, I'll need to look into your account details and recent transaction history. For security purposes, I'll need to ask for a few pieces of personal information to verify your identity. Could you please provide your full name, registered email address, and the last four digits of your account number? Rest assured, your information will be handled securely and confidentially.","**Chatbot Response:**

I completely understand how frustrating this situation must be for you, Sarah, and I appreciate your patience. Let’s work together to resolve this as quickly as possible. 

To help me assist you better, please follow these steps:

- **Account Verification:** I’ll need to verify your identity with a few pieces of personal information.
- **Transaction History:** I'll review your recent transaction history to pinpoint the issue.

I’m here to support you, so please don’t worry—let’s get this sorted out!"
3,"Ugh, fine. But hurry up.","Thank you, Sarah. After reviewing your account, it appears there is a temporary hold on your account due to a recent security check. This is a standard procedure to ensure the safety of your funds.","Thank you, Sarah. After reviewing your account, it appears there is a temporary hold on your account due to a recent security check. This is a standard procedure to ensure the safety of your funds. Our team is actively working to resolve this, and we expect the hold to be lifted shortly. We apologize for any inconvenience this may cause and appreciate your understanding. If you have any further questions or need additional assistance, please feel free to reach out to us.","**Message:**

Hi Sarah, I completely understand your urgency—I’m here to help! 

There’s a temporary hold on your account due to a standard security check, which is very important for keeping your funds safe. Here’s what we can do:

- **Review**: The hold is part of our commitment to security. 
- **Action**: We’re actively working on it.
- **Timeline**: I’ll keep you updated on the progress.

Rest assured, we’re prioritizing this and will resolve it as quickly as possible. Thank you for your patience!"
3,Security check? What are you talking about? I haven't done anything suspicious.,"I understand, Sarah. This is a precautionary measure we take to prevent unauthorized transactions. To release the hold, I need to ask you a couple of security questions to confirm your identity.","I understand, Sarah. This is a precautionary measure we take to prevent unauthorized transactions. To release the hold, I need to ask you a couple of security questions to confirm your identity.","**Chatbot Response:**

I completely understand your concern, Sarah. This hold is just a routine security step we implement to ensure your account’s safety. To lift the hold, we just need to verify a few details.

Here's how we can move forward:

- **Security Questions**: I’ll ask you a couple of quick questions.
- **Confirmation**: Once we confirm your identity, we’ll release the hold immediately.

Don’t worry, I’m here to help you through this process. Your security is just as important to us!"
3,"Fine, just get it over with.","(Asks security questions, Sarah provides answers) Great, Sarah! The security check has been cleared, and your account should now be fully functional. You can now attempt your gym payment again.","Great, Sarah! The security check has been cleared, and your account should now be fully functional. You can now attempt your gym payment again.","**Chatbot Response:**

Hi Sarah! I’m glad to inform you that your security check has been successfully completed. Your account is now fully functional. 

Here’s what you can do next:
- Feel free to attempt your gym payment again.
- If you encounter any issues, just let me know, and I’ll be here to assist you.

You’re doing great, and I’m here to support you every step of the way!"
3,"Ok, let's hope this works.","Let me know if the transaction is successful, Sarah. I'm here if you need any further assistance.","Thank you for reaching out, Sarah. Please check your transaction history in the Jupiter Money app to confirm if the transaction was successful. If you need any further assistance or encounter any issues, feel free to let me know. I'm here to help!","**Rephrased Response:**

Hi Sarah! 

I completely understand your concerns, and I’m here to support you through this. Please keep me updated on the transaction’s status—I’m hopeful that everything will go smoothly. 

To make things easier, here are a few steps to follow:
- Confirm if the transaction was successful when you can.
- If you encounter any issues, reach out to me directly.

Remember, you’re not alone in this! I'm here to help."
3,"(After a moment) It worked! Thank you. I'm still frustrated, but at least it's done.","You're welcome, Sarah. I'm glad we were able to resolve the issue. Have a great workout!","You're welcome, Sarah. I'm glad we were able to resolve the issue. Have a great workout!","**Rephrased Response:**

I'm really glad to hear it worked for you, Sarah! It's understandable to feel frustrated, but it's great that we've got this sorted out. Here’s what you can do now:

- **Focus on your workout:** Use this momentum to have a great session!
- **Take it one step at a time:** If anything else comes up, just let me know; I'm here to help.

You've got this! Enjoy your workout!"
4,"This is ridiculous! I'm trying to send money to my friend, and this app keeps giving me an error message. I need this money sent now, it's urgent! What's going on?","Hi Sarah, I understand your frustration. It seems you're experiencing an issue with a transaction. Could you please tell me more about the error message you received? Also, can you confirm the amount and recipient details you're trying to send?","Hi Sarah, I understand your frustration. It seems you're experiencing an issue with a transaction. Could you please tell me more about the error message you received? Also, can you confirm the amount and recipient details you're trying to send?","**Rephrased Chatbot Response:**

Hi Sarah,

I completely understand how frustrating this must be for you, especially with the urgency to send money to your friend. Let’s work together to resolve this quickly. 

Could you please provide me with:

- The exact error message you encountered
- The amount you are trying to send
- The recipient's details

Once I have this information, I’ll be able to assist you further and help ensure your transaction goes through smoothly. You're not alone in this—I’m here to help!"
4,"It just says 'Transaction failed. Please try again later.' I'm trying to send $200 to [Friend's Name] at [Friend's Account Number]. It's for her birthday, and I told her I'd send it today!","Thanks for providing the details, Sarah. Let's see if we can get this resolved. Could you please try restarting your app and attempting the transaction again? If the issue persists, we may need to investigate further.","Thanks for providing the details, Sarah. Let's see if we can get this resolved. Could you please try restarting your app and attempting the transaction again? If the issue persists, we may need to investigate further.","Hey Sarah, I understand how important it is to get that birthday gift sent on time, and I’m here to help you.

Let’s try a couple of steps to see if we can resolve this:

1. **Restart the App**: Close the app completely and then reopen it.
2. **Retry the Transaction**: Attempt to send the $200 to [Friend's Name] again.

If the transaction still doesn't go through, please let me know, and we’ll explore what else we can do to fix this together. You’re not alone in this, and I’m confident we’ll find a solution!"
